link,representation,law_firms
https://www.bailii.org/ew/cases/EWCA/Civ/2019/93.html,"Mr Kevin Prosser QC and Mr Charles Bradley (instructed by Dentons UK and Middle East LLP) for the Appellants
Mr Akash Nawbatt QC and Miss Kate Balmer (instructed by the General Counsel and Solicitor to HM Revenue and Customs) for the Respondents
Hearing dates: 15 and 16 January 2019","[('Dentons UK and Middle East LLP', 'Appellants'), ('the General Counsel and Solicitor to HM Revenue and Customs', 'Respondents')]"
https://www.bailii.org/ew/cases/EWCA/Civ/2019/474.html,"Giles Goodfellow, Q.C. and Ben Elliott (instructed by Mazars LLP, accountants) for the Appellants
Akash Nawbatt, Q.C. and Kate Balmer (instructed by the General Counsel and
Solicitor to HM Revenue and Customs) for the Respondents
Hearing date: 5 March 2019","[('Mazars LLP, accountants', 'Appellants'), ('the General Counsel and\r\nSolicitor to HM Revenue and Customs', 'Respondents')]"
https://www.bailii.org/ew/cases/EWCA/Civ/2019/485.html,"David Scorey QC (instructed by Forbes Hall LLP) for the First and Second Appellants
Andrew Hitchmough QC and Jonathan Bremner QC (instructed by Eversheds Sutherland (International) LLP) for the Third Appellant
Kieron Beal QC (instructed by PriceWaterhouseCoopers LLP) for the Fourth and Fifth Appellants
Jonathan Peacock QC and Michael Ripley (instructed by Ashurst LLP) for the Sixth Appellant
Andrew Macnab and Peter Mantle (instructed by General Counsel and Solicitor to HM Revenue and Customs) for the First Respondents
Ian Glick QC, Victoria Wakefield, and Adam Rushworth (instructed by Norton Rose Fulbright ) for the Second Respondent
Hearing dates: 21, 22, 23 and 24 January 2019","[('Forbes Hall LLP', 'First and Second Appellants'), ('Eversheds Sutherland (International) LLP', 'Third Appellant'), ('PriceWaterhouseCoopers LLP', 'Fourth and Fifth Appellants'), ('Ashurst LLP', 'Sixth Appellant'), ('General Counsel and Solicitor to HM Revenue and Customs', 'First Respondents'), ('Norton Rose Fulbright', 'Second Respondent')]"
https://www.bailii.org/ew/cases/EWCA/Civ/2019/353.html,"Oliver Conolly (instructed by RG Legal Limited) for the Appellant
Eleni Mitrophanous (instructed by the General Counsel and Solicitor to HM Revenue and Customs) for the Respondent
Hearing date : 14 February 2019","[('RG Legal Limited', 'Appellant'), ('the General Counsel and Solicitor to HM Revenue and Customs', 'Respondent')]"
https://www.bailii.org/ew/cases/EWCA/Civ/2019/319.html,"Mr Jonathan Kinnear QC and Mr Matthew Donmall (instructed by the General Counsel and Solicitor to HMRC) for the Appellants
Mr Michael Patchett-Joyce and Mr Oliver Powell (instructed by Imran Khan & Partners) for the Respondent
Hearing date: 4 December 2018","[('the General Counsel and Solicitor to HMRC', 'Appellants'), ('Imran Khan & Partners', 'Respondent')]"
https://www.bailii.org/ew/cases/EWCA/Civ/2019/676.html,"David Lock QC and Richard Clarke (instructed by Haven Solicitors Ltd) for the Appellant
Jonathan Holl-Allen QC and Aaron Rathmell (instructed by Staffordshire Police and West Midland Police Joint Legal Services) for the Respondent
Hearing date: 6 December 2018","[('Haven Solicitors Ltd', 'Appellant'), ('Staffordshire Police and West Midland Police Joint Legal Services', 'Respondent')]"
https://www.bailii.org/ew/cases/EWCA/Civ/2019/554.html,"Rory Mullan and Harriet Brown (acting pro bono under licence from the Bar Pro Bono Unit) for the Appellant
Jeremy Benson QC and Karen Robinson at the first hearing, Sarabjit Singh QC at the second hearing (instructed by the General Counsel and Solicitor to HM Revenue and Customs) for the Respondents
Hearing dates :  12 February 2019 and 25 March 2019","[('the General Counsel and Solicitor to HM Revenue and Customs', 'Respondents')]"
https://www.bailii.org/ew/cases/EWCA/Civ/2019/615.html,"Richard Drabble QC and Tom Royston (instructed by the Child Poverty Action Group) for the Appellants
James Eadie QC and Galina Ward (instructed by the Government Legal Department) for the Respondents
Helen Mountfield QC and Raj Desai (instructed by the Equality and Human Rights Commission) for the Intervener
Hearing dates: 19 and 20 December 2018","[('the Child Poverty Action Group', 'Appellants'), ('the Government Legal Department', 'Respondents'), ('the Equality and Human Rights Commission', 'Intervener')]"
https://www.bailii.org/ew/cases/EWCA/Civ/2019/692.html,"Mr Ian Wise QC & Mr Azeem Suterwalla (instructed by Hopkin Murray Beskine) for the Respondents Teresa Ward & Ors in the first appeal
Mr Jamie Burton (instructed by Osbornes Solicitors LLP) for the Appellant Yilmaz Gullu in the second appeal
Mr Kelvin Rutledge QC & Mr Andrew Lane (instructed by London Borough of Hillingdon in both appeals) for the Appellant in the first appeal and the Respondent in the second appeal
Mr Dan Squires QC & Mr Chris Buttler (instructed by the Equality and Human Rights Commission) for the Intervener in both appeals
Hearing dates : 3rd and 4th April 2019","[('Hopkin Murray Beskine', 'Respondents Teresa Ward & Ors in the first appeal'), ('Osbornes Solicitors LLP', 'Appellant Yilmaz Gullu in the second appeal'), ('London Borough of Hillingdon in both appeals', 'Appellant in the first appeal and the Respondent in the second appeal'), ('the Equality and Human Rights Commission', 'Intervener in both appeals')]"
https://www.bailii.org/ew/cases/EWCA/Civ/2019/747.html,"Mr Giles Goodfellow QC and Mr Ben Elliott (instructed by Levy & Levy) for the Appellant
Mr Timothy Brennan QC and Mr Christopher Stone (instructed by General Counsel and Solicitor to HM Revenue and Customs) for the Respondents
Hearing dates: 2-3 April 2019","[('Levy & Levy', 'Appellant'), ('General Counsel and Solicitor to HM Revenue and Customs', 'Respondents')]"
https://www.bailii.org/ew/cases/EWCA/Civ/2019/841.html,"Jonathan Hall QC and Will Hays (instructed by General Counsel and Solicitor to HM Revenue and Customs) for the Appellants
David Bedenham (instructed by Rainer Hughes) for the Respondents
Hearing date : 27 March 2019","[('General Counsel and Solicitor to HM Revenue and Customs', 'Appellants'), ('Rainer Hughes', 'Respondents')]"
https://www.bailii.org/ew/cases/EWCA/Civ/2019/891.html,"Lord Falconer of Thoroton, Vernon Flynn QC, Siward Atkins and Andrew Scott (instructed by Gibson Dunn and Crutcher UK LLP) for the Appellant
Jonathan Crow QC and David Caplan (instructed by Mishcon de Reya LLP) for the Respondent
Hearing dates: 9-10 April 2019","[('Gibson Dunn and Crutcher UK LLP', 'Appellant'), ('Mishcon de Reya LLP', 'Respondent')]"
https://www.bailii.org/ew/cases/EWCA/Civ/2019/809.html,"Karon Monaghan QC and Jude Bunting (instructed by Matthew Gold and Co. Ltd) for the Appellant
Alison Hewitt (instructed by Oxfordshire County Council Legal Services) for the Respondent
Jonathan Hough QC (instructed by the Chief Coroner) for the Chief Coroner (as Intervener)
Adam Straw (instructed by Hickman & Rose) submitted written submissions on behalf of INQUEST (as Intervener)
Hearing date : 9th April 2019","[('Matthew Gold and Co. Ltd', 'Appellant'), ('Oxfordshire County Council Legal Services', 'Respondent'), ('the Chief Coroner', 'Chief Coroner')]"
https://www.bailii.org/ew/cases/EWCA/Civ/2019/854.html,"Mr Roderick Cordara QC (instructed by Mishcon de Reya LLP) for the Appellant
Mr Brendan McGurk (instructed by the General Counsel and Solicitor to HM Revenue and Customs) for the Respondents
Hearing date: 2 May 2019","[('Mishcon de Reya LLP', 'Appellant'), ('the General Counsel and Solicitor to HM Revenue and Customs', 'Respondents')]"
https://www.bailii.org/ew/cases/EWCA/Civ/2019/849.html,"Miss Hui Ling McCarthy QC (instructed by the General Counsel and Solicitor to HM Revenue and Customs) for the Appellants
Miss Melanie Hall QC (instructed by KPMG LLP) for the Respondent
Hearing dates: 10-11 April 2019","[('the General Counsel and Solicitor to HM Revenue and Customs', 'Appellants'), ('KPMG LLP', 'Respondent')]"
https://www.bailii.org/ew/cases/EWCA/Civ/2019/826.html,"Hui Ling McCarthy QC and John Brinsmead-Stockham (instructed by General Counsel and Solicitor to HM Revenue and Customs) for the Appellants
Julian Ghosh QC and Charles Bradley (instructed by Pinsent Masons) for the Respondent
Hearing date: 2 April 2019","[('General Counsel and Solicitor to HM Revenue and Customs', 'Appellants'), ('Pinsent Masons', 'Respondent')]"
https://www.bailii.org/ew/cases/EWCA/Civ/2019/888.html,"Ms Estelle Dehon (instructed by Richard Buxton Environmental and Public Law) 
for the Appellant
Mr Hugh Richards (instructed by Shropshire Council) for the Respondent
Mr Christian Hawley (instructed by Hewitsons LLP) for the Interested Party
Hearing date: 19 March 2019","[('Richard Buxton Environmental and Public Law', 'Appellant'), ('Shropshire Council', 'Respondent'), ('Hewitsons LLP', 'Interested Party')]"
https://www.bailii.org/ew/cases/EWCA/Civ/2019/1021.html,"Mr Conrad McDonnell (instructed by KPMG LLP) for the Appellant
Mr David Yates QC (instructed by the General Counsel and Solicitor to HMRC) for the Respondents
Hearing date: 14th May 2019","[('KPMG LLP', 'Appellant'), ('the General Counsel and Solicitor to HMRC', 'Respondents')]"
https://www.bailii.org/ew/cases/EWCA/Civ/2019/913.html,"Sam Karim QC and Francesca Gardner (instructed by MJC Law) for B
David Lock QC and Simon Garlick (instructed by Legal and Democratic Services) for the Local Authority
Hearing dates : 14 & 15 May 2019","[('Legal and Democratic Services', 'Local Authority')]"
https://www.bailii.org/ew/cases/EWCA/Civ/2019/1230.html,"Mr Ned Westaway (instructed by Richard Buxton Environmental and Public Law) for the Appellant
Ms Jacqueline Lean (instructed by the Government Legal Department) for the 
1st Respondent 
The 2nd Respondent and the Interested Party did not appear and were not represented
Hearing Date: 27th June 2019","[('Richard Buxton Environmental and Public Law', 'Appellant'), ('the Government Legal Department', '')]"
https://www.bailii.org/ew/cases/EWCA/Civ/2019/1010.html,"Michael Firth (instructed by Reynolds Porter Chamberlain LLP) for the Appellant
Sadiya Choudhury (instructed by the General Counsel and Solicitor to HM Revenue and Customs) for the Respondents
Hearing date: 16 May 2019","[('Reynolds Porter Chamberlain LLP', 'Appellant'), ('the General Counsel and Solicitor to HM Revenue and Customs', 'Respondents')]"
https://www.bailii.org/ew/cases/EWCA/Civ/2019/1080.html,"Edward Brown (instructed by Government Legal Department) for the Appellant
Tom Royston (instructed by Child Poverty Action Group) for the First Respondent
Alison Meacher (instructed by Nuneaton and Bedworth Borough Council) for the Second Respondent
Hearing date: 21 May 2019","[('Government Legal Department', 'Appellant'), ('Child Poverty Action Group', 'First Respondent'), ('Nuneaton and Bedworth Borough Council', 'Second Respondent')]"
https://www.bailii.org/ew/cases/EWCA/Civ/2019/985.html,"Mr David Berkley QC and Mr Christopher Snell (instructed by Lexlaw Solicitors and Advocates) for the Appellant
Mr Andrew Onslow QC and Ms Hannah Glover (instructed by Mills & Reeve LLP) for the Respondent
Hearing date: 16th May 2019","[('Lexlaw Solicitors and Advocates', 'Appellant'), ('Mills & Reeve LLP', 'Respondent')]"
https://www.bailii.org/ew/cases/EWCA/Civ/2019/1239.html,"Stephanie Harrison QC and Leonie Hirst (instructed by Bhatt Murphy) 
for the Appellant ASK
Amanda Weston QC and Leonie Hirst (instructed by Deighton Pierce Glynn) 
for the Appellant MDA
Sir James Eadie QC and Julie Anderson (instructed by Government Legal Department) 
for the Respondent
Patrick Green QC and Christopher Knight (instructed by Browne Jacobson LLP) 
for NHS England
Holly Stout (instructed by Government Legal Department) for the Secretary of State for Health and Social Care (written submissions only) 
Julie Anderson (instructed by Government Legal Department)
 for the Secretary of State for Justice 
Helen Mountfield QC (instructed by Keith Ashcroft, Equality and Human Rights Commission) for the Intervener (written submissions only)

Hearing dates: 14-16 May 2019
Further written submissions: 23 May 2019","[('Bhatt Murphy', 'Appellant ASK'), ('Deighton Pierce Glynn', 'Appellant MDA'), ('Government Legal Department', 'Respondent'), ('Government Legal Department', 'Secretary of State for Health and Social Care'), ('Government Legal Department', 'Secretary of State for Justice'), ('Keith Ashcroft, Equality and Human Rights Commission', 'Intervener')]"
https://www.bailii.org/ew/cases/EWCA/Civ/2019/1301.html,"Sam Grodzinski QC and Michael Jones (instructed by PricewaterhouseCoopers LLP) for the Appellant
Rupert Baldry QC (instructed by the General Counsel and Solicitors for HMRC) for the Respondents
Hearing date: 9 July 2019","[('PricewaterhouseCoopers LLP', 'Appellant'), ('the General Counsel and Solicitors for HMRC', 'Respondents')]"
https://www.bailii.org/ew/cases/EWCA/Civ/2019/1357.html,"Mr Alistair Webster QC and Mr Michael Firth (instructed by Morrisons Solicitors LLP) for the Claimant
Mr Jonathan Kinnear QC and Ms Natasha Barnes (instructed by the General Counsel and Solicitor to HMRC) for the Defendants
Hearing dates: 21 & 22 May 2019","[('Morrisons Solicitors LLP', 'Claimant'), ('the General Counsel and Solicitor to HMRC', 'Defendants')]"
https://www.bailii.org/ew/cases/EWCA/Civ/2019/1160.html,"Jonathan Crow QC and David Drake (instructed by Peters and Peters Solicitors LLP) for the Appellants
Kelyn Bacon QC and Daniel Piccinin (instructed by Sidley Austin LLP) for the Respondents
Hearing dates : 11 & 12 June 2019","[('Peters and Peters Solicitors LLP', 'Appellants'), ('Sidley Austin LLP', 'Respondents')]"
https://www.bailii.org/ew/cases/EWCA/Civ/2019/1392.html,"Roger Thomas QC and Emma Pearce (instructed by One Legal) for the Appellant
Michael Jones (instructed by  the General Counsel and Solicitor  to HM Revenue and Customs) for the Respondents
Hearing date : 16 & 17 July 2019","[('One Legal', 'Appellant'), ('the General Counsel and Solicitor  to HM Revenue and Customs', 'Respondents')]"
https://www.bailii.org/ew/cases/EWCA/Civ/2019/1220.html,"Nicholas Bacon QC and Rupert Cohen (instructed by Kain Knight Costs Lawyers, as agents for Slater and Gordon (UK) Ltd and Forster Dean Solicitors) for the Appellants
Roger Mallalieu (instructed by Acumension Ltd) for the NHS Trust
Hearing dates : 18 & 19 June 2019","[('Kain Knight Costs Lawyers, as agents for Slater and Gordon (UK) Ltd and Forster Dean Solicitors', 'Appellants'), ('Acumension Ltd', 'NHS Trust')]"
https://www.bailii.org/ew/cases/EWCA/Civ/2019/1724.html,"Claire Darwin & Emma Foubister (instructed by Hausfeld & Co. LLP)
for the Appellant
Lord Faulks QC & Adam Clemens (instructed by Weightmans LLP and Clyde & Co. LLP)
for the Respondents
Ben Jaffey QC & Raj Desai  
(instructed by The Equality and Human Rights Commission) for the Intervener
Hearing date: 3rd October 2019","[('Hausfeld & Co. LLP', 'Appellant'), ('Weightmans LLP and Clyde & Co. LLP', 'Respondents'), ('The Equality and Human Rights Commission', 'Intervener')]"
https://www.bailii.org/ew/cases/EWCA/Civ/2019/1631.html,"Mr Mark Hoskins QC & Ms Jennifer MacLeod (instructed by Competition and Markets Authority) for the Appellant
Mr Mark Brealey QC, Mr Robert O'Donoghue QC and Mr Tim Johnston (instructed by Clifford Chance LLP) for the 3rd & 4th Respondents
Hearing date: Thursday 26th September 2019","[('Competition and Markets Authority', 'Appellant'), ('Clifford Chance LLP', '3rd & 4th Respondents')]"
https://www.bailii.org/ew/cases/EWCA/Civ/2019/1610.html,"Mr Rupert Baldry QC and Mr Oliver Conolly (instructed by the General Counsel and Solicitor to HM Revenue and Customs) for the Appellants
Mr Malcolm Gammie QC and Mr James Rivett QC (instructed by Pinsent Masons LLP) for the Respondent
Hearing dates: 25-27 June 2019","[('the General Counsel and Solicitor to HM Revenue and Customs', 'Appellants'), ('Pinsent Masons LLP', 'Respondent')]"
https://www.bailii.org/ew/cases/EWCA/Civ/2019/1675.html,"Robert Talalay (instructed by Avon and Somerset Police) for the Appellant
The Respondent appeared in person
Hearing date: 25 September 2019","[('Avon and Somerset Police', 'Appellant')]"
https://www.bailii.org/ew/cases/EWCA/Civ/2019/1860.html,"Miss Nicola Shaw QC and Mr Samuel Brodsky (instructed by Fieldfisher LLP) for the Appellant
Mr Christopher Stone and Mr Nicholas Macklam (instructed by the General Counsel and Solicitor to HM Revenue and Customs) for the Respondents
Hearing date: 15 October 2019","[('Fieldfisher LLP', 'Appellant'), ('the General Counsel and Solicitor to HM Revenue and Customs', 'Respondents')]"
https://www.bailii.org/ew/cases/EWCA/Civ/2019/2175.html,"Stephen Robins (instructed by Birketts Llp) for the Appellant
Brian Doctor QC and Sebastian Kokelaar (instructed by Richard Slade and Company Limited) for the Respondent
Hearing date: 20 November 2019","[('Birketts Llp', 'Appellant'), ('Richard Slade and Company Limited', 'Respondent')]"
https://www.bailii.org/ew/cases/EWCA/Civ/2019/2032.html,"Timothy Cowen (instructed by Richmond and Barnes Solicitors) for the Appellants
Aaron Walder (instructed by York Solicitors) for the Respondent
Hearing date : 6 November 2019","[('Richmond and Barnes Solicitors', 'Appellants'), ('York Solicitors', 'Respondent')]"
https://www.bailii.org/ew/cases/EWCA/Civ/2019/2176.html,"Mr Joshua Carey (instructed by The Solicitor's Office and Legal Service) for the Appellants
Mr Tim Brown (instructed by Hugh James Solicitors) for the Respondent
Hearing date: 26 November 2019","[(""The Solicitor's Office and Legal Service"", 'Appellants'), ('Hugh James Solicitors', 'Respondent')]"
https://www.bailii.org/ew/cases/EWCA/Civ/2019/2272.html,"Tom Mitcheson QC and James Whyte (instructed by Simmons and Simmons LLP) for the Appellant
Daniel Alexander QC and Lindsay Lane QC (instructed by Pinsent Masons LLP) for Teva
Daniel Alexander QC and Kathryn Pickard (instructed by Taylor Wessing LLP) for Accord
Daniel Alexander QC and Joe Delaney (instructed by Taylor Wessing LLP) for Mylan
Daniel Alexander QC and Jaani Riordan (instructed by Mishcon de Reya LLP) for Lupin 
Hearing date: 10 December 2019","[('Simmons and Simmons LLP', 'Appellant')]"
https://www.bailii.org/ew/cases/EWCA/Civ/2018/46.html,"David Bedenham (instructed by Morrisons Solicitors LLP) for the Appellant
Jonathan Hall QC and Richard Evans (instructed by the General Counsel and Solicitor to HM Revenue and Customs) for the Respondent
Hearing dates: 2 November 2017","[('Morrisons Solicitors LLP', 'Appellant'), ('the General Counsel and Solicitor to HM Revenue and Customs', 'Respondent')]"
https://www.bailii.org/ew/cases/EWCA/Civ/2018/62.html,"Mr Nigel Jones QC & Mr Edward Rowntree (instructed by Child & Child) for the Appellant
Mr David Cavender QC & Mr Michael Clark (instructed by Milbank, Tweed, Hadley and McCloy LLP) for the Respondent
Hearing date : 23rd January 2018","[('Child & Child', 'Appellant'), ('Milbank, Tweed, Hadley and McCloy LLP', 'Respondent')]"
https://www.bailii.org/ew/cases/EWCA/Civ/2018/24.html,"Mr Christopher Lockhart-Mummery Q.C. (instructed by Shakespeare Martineau LLP) 
for the Appellant
Mr Hereward Phillpot Q.C. and Ms Sasha Blackmore (instructed by the Government Legal Department) for the First Respondent 
Ms Thea Osmund-Smith (instructed by Hinckley and Bosworth Borough Council) for the Second Respondent 
Hearing date: 17 October 2017","[('Shakespeare Martineau LLP', 'Appellant'), ('the Government Legal Department', 'First Respondent'), ('Hinckley and Bosworth Borough Council', 'Second Respondent')]"
https://www.bailii.org/ew/cases/EWCA/Civ/2018/51.html,"Brian Doctor QC (instructed directly by Michael Wilson & Partners, Limited) for the Appellant
Philip Shepherd QC (instructed by Kerman and Co LLP) for the Respondent
 
Hearing dates : 16 and 17 January 2018","[('Kerman and Co LLP', 'Respondent')]"
https://www.bailii.org/ew/cases/EWCA/Civ/2018/31.html,"Mr Conrad McDonnell (instructed by Howard Kennedy LLP) for the Appellants
Mr James Rivett (instructed by General Counsel and Solicitor to HM Revenue and Customs) for the Respondents
Hearing dates : 6 and 7 December 2017","[('Howard Kennedy LLP', 'Appellants'), ('General Counsel and Solicitor to HM Revenue and Customs', 'Respondents')]"
https://www.bailii.org/ew/cases/EWCA/Civ/2018/26.html,"Mr Richard Glover QC (instructed by DLA Piper UK LLP) for the Appellant
Ms Hui Ling McCarthy (instructed by HM Revenue and Customs Solicitor's Office) for the Respondent
Hearing date: 1st November 2017","[('DLA Piper UK LLP', 'Appellant'), (""HM Revenue and Customs Solicitor's Office"", 'Respondent')]"
https://www.bailii.org/ew/cases/EWCA/Civ/2018/17.html,"Mr Malcolm Gammie QC (instructed by Herbert Smith Freehills LLP) for the Appellant
Mr Akash Nawbatt QC (instructed by the General Counsel and Solicitor to HM Revenue and Customs) for the Respondents
Hearing dates : 22 and 23 November 2017","[('Herbert Smith Freehills LLP', 'Appellant'), ('the General Counsel and Solicitor to HM Revenue and Customs', 'Respondents')]"
https://www.bailii.org/ew/cases/EWCA/Civ/2018/45.html,"The Appellant appeared in person 
Mr Michael Jones (instructed by the General Counsel and Solicitor to HM Revenue and Customs) for the Respondents
Hearing date: 7th November 2017","[('the General Counsel and Solicitor to HM Revenue and Customs', 'Respondents')]"
https://www.bailii.org/ew/cases/EWCA/Civ/2018/135.html,"Mr Michael Firth (instructed by Morrisons Solicitors LLP) for the Appellant
Mr James Puzey (instructed by the General Counsel and Solicitor to HM Revenue and Customs) for the Respondents
Hearing dates: 12 and 13 December 2017","[('Morrisons Solicitors LLP', 'Appellant'), ('the General Counsel and Solicitor to HM Revenue and Customs', 'Respondents')]"
https://www.bailii.org/ew/cases/EWCA/Civ/2018/280.html,"Ms Karon Monaghan QC (instructed by the Anti-trafficking and Labour Exploitation Unit) for the Appellant
The Respondent did not appear and was not represented 
Hearing date: 24 January 2018","[('the Anti-trafficking and Labour Exploitation Unit', 'Appellant')]"
https://www.bailii.org/ew/cases/EWCA/Civ/2018/161.html,"Thomas Munby (instructed by Hatch Brenner LLP) for the Appellants
Neil Cadwallader (instructed by Richard Slade and Co) for the Respondents
Hearing dates: 7 November 2017","[('Hatch Brenner LLP', 'Appellants'), ('Richard Slade and Co', 'Respondents')]"
https://www.bailii.org/ew/cases/EWCA/Civ/2018/556.html,"Mr Marc Willers Q.C. and Ms Justine Compton (instructed by Richard Buxton Environmental and Public Law) for the Appellant
Mr Stephen Whale (instructed by London Borough of Ealing Council) for the Respondent
Mr Reuben Taylor Q.C. (instructed by Withers LLP) for the Interested Party
Hearing date: 12 December 2017","[('Richard Buxton Environmental and Public Law', 'Appellant'), ('London Borough of Ealing Council', 'Respondent'), ('Withers LLP', 'Interested Party')]"
https://www.bailii.org/ew/cases/EWCA/Civ/2018/315.html,"Mr Keith Gordon & Ms Ximena Montes Manzano (instructed by Sharpe Pritchard LLP) for the Appellants
Mr Timothy Brennan QC & Mr Akash Nawbatt QC (instructed by the General Counsel and Solicitor to HM Revenue and Customs) for the Respondents
Hearing date: 5 December 2017","[('Sharpe Pritchard LLP', 'Appellants'), ('the General Counsel and Solicitor to HM Revenue and Customs', 'Respondents')]"
https://www.bailii.org/ew/cases/EWCA/Civ/2018/504.html,"Mr Clive Sheldon QC and Mr Simon Pritchard (instructed by Government Legal Department) for the Appellant
Mr Ian Wise QC, Ms Caoilfhionn Gallagher QC and Mr Michael Armitage (instructed by Hopkin Murray Beskine) for the Respondents    
Ms Helen Mountfield QC and Mr Raj Desai (instructed by the Equality and Human Rights Commission) for the First Intervener
Mr Martin Westgate QC, Ms Shu Shin Lu and Mr Connor Johnston (instructed by Freshfields Bruckhaus Deringer LLP) for the Second Intervener
Hearing dates: 24, 25 October 2017","[('Government Legal Department', 'Appellant'), ('Hopkin Murray Beskine', 'Respondents'), ('the Equality and Human Rights Commission', 'First Intervener'), ('Freshfields Bruckhaus Deringer LLP', 'Second Intervener')]"
https://www.bailii.org/ew/cases/EWCA/Civ/2018/674.html,"Anthony Katz (instructed by Lamb and Holmes LLP) for the Appellant
Stephen Taylor (instructed by Tollers LLP) for the Respondent
Hearing date: 12th October 2017","[('Lamb and Holmes LLP', 'Appellant'), ('Tollers LLP', 'Respondent')]"
https://www.bailii.org/ew/cases/EWCA/Civ/2018/568.html,"Mr Kieron Beal QC and Mr Sarabjit Singh (instructed by General Counsel and Solicitor to HMRC) for the Appellants
Mr Andrew Hitchmough QC and Ms Barbara Belgrano (instructed by The University of Cambridge) for the Respondents
Hearing dates : 13 and 14 December 2017","[('General Counsel and Solicitor to HMRC', 'Appellants'), ('The University of Cambridge', 'Respondents')]"
https://www.bailii.org/ew/cases/EWCA/Civ/2018/368.html,"Mr David Carter (instructed by Local Authority Legal Services for Wealdon and Rother District Councils) for the Appellant
Ms Leanne Buckley-Thomson (instructed by BHT Eastbourne Advice) for the Respondent
Hearing date: 20 February 2018","[('Local Authority Legal Services for Wealdon and Rother District Councils', 'Appellant'), ('BHT Eastbourne Advice', 'Respondent')]"
