link,representation,law_firms
https://www.bailii.org/ew/cases/EWCA/Civ/2017/83.html,"Christopher Hancock QC, Jonathan Crystal, David Caplan and Charlotte Tan 
(instructed by McGuire Woods London LLP) for the Appellants
Robert Miles QC, Jeremy Goldring QC and Tom Gentleman 
(instructed by Travers Smith LLP and Clifford Chance LLP) for the Respondents
Hearing dates : 1 and 2 February 2017","[('McGuire Woods London LLP', 'Appellants'), ('Travers Smith LLP and Clifford Chance LLP', 'Respondents')]"
https://www.bailii.org/ew/cases/EWCA/Civ/2017/227.html,"Simon Malynicz QC and Alaina Newnes (instructed by Stephenson Harwood LLP) for the Appellants
Martin Howe QC and Iona Berkeley (instructed by White and Case LLP) for the Respondents
Hearing date: 23 March 2017","[('Stephenson Harwood LLP', 'Appellants'), ('White and Case LLP', 'Respondents')]"
https://www.bailii.org/ew/cases/EWCA/Civ/2017/198.html,"Michael Sherry instructed by direct access for the Appellants
Michael Gibbon QC and Elizabeth Wilson (instructed by The General Counsel and Solicitor to HM Revenue & Customs) for the Respondents
Hearing date: 13 March 2017","[('The General Counsel and Solicitor to HM Revenue & Customs', 'Respondents')]"
https://www.bailii.org/ew/cases/EWCA/Civ/2017/331.html,"Matthew Stanbury (instructed by Kyles Legal Practice and Swain & Co Solicitors) for the Appellants
Matthew Slater (instructed by The Government Legal Department) for the Respondent
Hearing date: 04 April 2017","[('Kyles Legal Practice and Swain & Co Solicitors', 'Appellants'), ('The Government Legal Department', 'Respondent')]"
https://www.bailii.org/ew/cases/EWCA/Civ/2017/435.html,"Ms Hui Ling McCarthy (instructed by GRM Law) for the Appellant
Ms Aparna Nathan (instructed by the General Counsel and Solicitor for HMRC) for the Respondents
Hearing date: 4 April 2017","[('GRM Law', 'Appellant'), ('the General Counsel and Solicitor for HMRC', 'Respondents')]"
https://www.bailii.org/ew/cases/EWCA/Civ/2017/429.html,"Paul Stinchcombe QC and Ned Helme (instructed by Edwin Coe LLP) for the Claimant
Tom Cosgrove QC and Robert Williams (instructed by Royal Borough of 
Kensington and Chelsea Legal Department) for the Defendant
The First Interested Party did not appear and was not represented
Paul Brown QC (instructed by Berwin Leighton Paisner) for the Second Interested Parties
Hearing date: 16-17 May 2017","[('Edwin Coe LLP', 'Claimant'), ('Royal Borough of \r\nKensington and Chelsea Legal Department', 'Defendant'), ('Berwin Leighton Paisner', 'Second Interested Parties')]"
https://www.bailii.org/ew/cases/EWCA/Civ/2017/956.html,"Philip Coppel QC & David Bedenham (instructed by Rainer Hughes for the First Appellant and Bark & Co Solicitors) for the Second Appellant
James Eadie QC & Amy Mannion (instructed by HMRC's Solicitors Office) for the Respondent
Hearing dates: 10th May & 11th May 2017","[('Rainer Hughes for the First Appellant and Bark & Co Solicitors', 'Second Appellant'), (""HMRC's Solicitors Office"", 'Respondent')]"
https://www.bailii.org/ew/cases/EWCA/Civ/2017/1004.html,"Wayne Beglan and Tara O'Leary (instructed by Legal and Regulatory Services, 
Bridgend County Borough Council) for the Appellant
George Newsom (instructed by Thomas Simon Solicitors) for the Respondent
Hearing date: 27 June 2017","[('Legal and Regulatory Services, \r\nBridgend County Borough Council', 'Appellant'), ('Thomas Simon Solicitors', 'Respondent')]"
https://www.bailii.org/ew/cases/EWCA/Civ/2017/1127.html,"Matt Hutchings QC (instructed by London Borough of Ealing) for the Appellant
Ian Wise QC and Michael Armitage (instructed by Hopkin Murray Beskine Solicitors) for the Respondents
Dan Squires QC (instructed by Equality and Human Rights Commission) for the Intervener
Hearing dates: 20 & 21 June 2017","[('London Borough of Ealing', 'Appellant'), ('Hopkin Murray Beskine Solicitors', 'Respondents'), ('Equality and Human Rights Commission', 'Intervener')]"
https://www.bailii.org/ew/cases/EWCA/Civ/2017/1129.html,"Timothy Collingwood (instructed by New Media LLP) for the Appellant
Andrew Thornton (instructed by Slaughter and May) for the Respondent
Hearing date: 15 December 2016","[('New Media LLP', 'Appellant'), ('Slaughter and May', 'Respondent')]"
https://www.bailii.org/ew/cases/EWCA/Civ/2017/1116.html,"Melanie Hall QC and Elizabeth Kelsey (instructed by Gordon Dadds LLP) for the Appellants
Sarabjit Singh (instructed by the General Counsel and Solicitor to HM Revenue and Customs) for the Respondents
Hearing dates : 27-29 June 2017","[('Gordon Dadds LLP', 'Appellants'), ('the General Counsel and Solicitor to HM Revenue and Customs', 'Respondents')]"
https://www.bailii.org/ew/cases/EWCA/Civ/2017/1028.html,"David Berkley QC and Matthew Mawdsley  (instructed by Pearson Solicitors and Financial Advisors) for the Appellant
Alexander Hutton QC and Nicholas Pilsbury (instructed by Browne Jacobson LLP) for the Respondents
Hearing date: 22 June 2017","[('Pearson Solicitors and Financial Advisors', 'Appellant'), ('Browne Jacobson LLP', 'Respondents')]"
https://www.bailii.org/ew/cases/EWCA/Civ/2017/1197.html,"Mr Nicholas Davidson QC (instructed by Fox and Partners Solicitors LLP ) for the Claimants
Mr Michael Pooles QC and Mr Nigel Porter (instructed by Reynolds Porter Chamberlain LLP) for the Defendant
Hearing date: 13 July 2017","[('Fox and Partners Solicitors LLP', 'Claimants'), ('Reynolds Porter Chamberlain LLP', 'Defendant')]"
https://www.bailii.org/ew/cases/EWCA/Civ/2017/1296.html,"Victor Richard Stockinger (instructed by Stockinger Advocates and Solicitors) 
for the Appellant
Peter Mant (instructed by The General Medical Council Legal Department) 
for the Respondent
Hearing date: 24 August 2017","[('Stockinger Advocates and Solicitors', 'Appellant'), ('The General Medical Council Legal Department', 'Respondent')]"
https://www.bailii.org/ew/cases/EWCA/Civ/2017/1308.html,"Jamie Burton (instructed by Irwin Mitchell LLP) for the Claimant
Jonathan Auburn and Zoe Gannon (instructed by Angela Mills, Principal Solicitor, Oxfordshire County Council) for the Defendant
Victoria Butler-Cole (instructed by The Equality and Human Rights Commission) for the First Intervener (written submissions only)
David Wolfe QC (instructed by Louise Whitfield, Deighton Pierce Glynn) for the Second Intervener
Hearing date: 17 August 2017","[('Irwin Mitchell LLP', 'Claimant'), ('Angela Mills, Principal Solicitor, Oxfordshire County Council', 'Defendant'), ('The Equality and Human Rights Commission', 'First Intervener'), ('Louise Whitfield, Deighton Pierce Glynn', 'Second Intervener')]"
https://www.bailii.org/ew/cases/EWCA/Civ/2017/1344.html,"Mr Tom Kark QC and Mr Justin Meiland (instructed by the Royal College of Nursing Legal Department) for the Appellant 
Ms Fenella Morris QC and Ms Alexis Hearnden (instructed by the Nursing and Midwifery Council Legal Department) for the Respondent
Hearing date: 11 May 2017
Further written submissions: 20 & 21 June 2017","[('the Royal College of Nursing Legal Department', 'Appellant'), ('the Nursing and Midwifery Council Legal Department', 'Respondent')]"
https://www.bailii.org/ew/cases/EWCA/Civ/2017/1327.html,"Adrienne Page QC and Godwin Busuttil (instructed by Taylor Hampton Solicitors) 
for the Claimant
David Price QC (instructed by David Price Solicitors and Advocates) for the Defendants
Hearing date: 1 December 2016","[('Taylor Hampton Solicitors', 'Claimant'), ('David Price Solicitors and Advocates', 'Defendants')]"
https://www.bailii.org/ew/cases/EWCA/Civ/2017/1334.html,"Andrew Caldecott QC, Manuel Barca QC and Hannah Ready (instructed by Lewis Silkin LLP) for the Appellant AOL (UK) Limited
David Price QC (instructed by David Price Solicitors and Advocates) for the Appellants, Independent Print Limited and Evening Standard Limited
Adrienne Page QC and Godwin Busuttil (instructed by Taylor Hampton) for the Respondent
Hearing dates: 29 and 30 November 2016","[('Lewis Silkin LLP', 'Appellant AOL'), ('David Price Solicitors and Advocates', 'Appellants, Independent Print Limited and Evening Standard Limited'), ('Taylor Hampton', 'Respondent')]"
https://www.bailii.org/ew/cases/EWCA/Civ/2017/1315.html,"Mr Paul Brown Q.C. (instructed by Richard Max and Co. LLP) for the Appellant in 
the first appeal
Ms Katrina Yates (instructed by the Government Legal Department) for the Appellant in the second appeal
Mr Richard Harwood Q.C. (instructed by Mishcon de Reya) for the Respondent in 
both appeals
Hearing date: 10 May 2017","[('Richard Max and Co. LLP', 'Appellant in'), ('the Government Legal Department', 'Appellant in the second appeal'), ('Mishcon de Reya', 'Respondent in')]"
https://www.bailii.org/ew/cases/EWCA/Civ/2017/1314.html,"Ms Annabel Graham Paul (instructed by Richard Buxton Environmental and Public Law) for the Appellant
Mr Juan Lopez (instructed by Tonbridge and Malling Borough Council Legal Services) 
for the Respondent
The interested parties did not appear and were not represented
Hearing date: 4 July 2017","[('Richard Buxton Environmental and Public Law', 'Appellant'), ('Tonbridge and Malling Borough Council Legal Services', 'Respondent')]"
https://www.bailii.org/ew/cases/EWCA/Civ/2017/1512.html,"Mr David Ewart QC (instructed by Forbes Hall LLP) for the Appellants
 Mr Rupert Baldry QC and Ms Sadiya Choudhury (instructed by the General Counsel and Solicitor to HMRC) for the Respondents

Hearing date: 24 May 2017","[('Forbes Hall LLP', 'Appellants'), ('the General Counsel and Solicitor to HMRC', 'Respondents')]"
https://www.bailii.org/ew/cases/EWCA/Civ/2017/1462.html,"Mr Robin Dicker QC, Mr Richard Fisher, and Mr Henry Phillips (instructed by Morrison & Foerster LLP, Freshfields Bruckhaus Deringer LLP, and Ropes & Gray International LLP) for the 1st, 2nd and 3rd Appellants
Mr Antony Zacaroli QC, Mr David Allison QC and Mr Adam Al-Attar (instructed by Kirkland & Ellis International LLP) for the 4th Appellant
Mr Tom Smith QC and Mr Robert Amey (instructed by Michelmores LLP) for the 5th Appellant
Mr Daniel Bayfield QC and Mr Stephen Robins (instructed by Linklaters LLP) for the Respondents
Hearing dates : 3 - 6 April 2017; 10 - 12 April 2017; and, 25 July 2017","[('Morrison & Foerster LLP, Freshfields Bruckhaus Deringer LLP, and Ropes & Gray International LLP', '1st, 2nd and 3rd Appellants'), ('Kirkland & Ellis International LLP', '4th Appellant'), ('Michelmores LLP', '5th Appellant'), ('Linklaters LLP', 'Respondents')]"
https://www.bailii.org/ew/cases/EWCA/Civ/2017/1426.html,"Helen Mountfield QC and Sarah Hannett (instructed by Ofsted Legal Services) for the Appellant
Peter Oldham QC and Joseph Barrett (instructed by Birmingham City Council Legal Services) for the Respondent
Martin Chamberlain QC and Tom Cross (instructed by the Government Legal Department) for the First Intervener
Daniel Squires QC (instructed by the Equality and Human Rights Commission) for the Second Intervener
Karon Monaghan QC and Aileen McColgan (instructed by the Public Law Project) for the Third Interveners
Hearing dates: 11th & 12th July 2017","[('Ofsted Legal Services', 'Appellant'), ('Birmingham City Council Legal Services', 'Respondent'), ('the Government Legal Department', 'First Intervener'), ('the Equality and Human Rights Commission', 'Second Intervener'), ('the Public Law Project', 'Third Interveners')]"
https://www.bailii.org/ew/cases/EWCA/Civ/2017/1427.html,"Ms Hui Ling McCarthy (instructed by Enyo Law LLP) for the Appellant
Mr Michael Gibbon QC and Mr Michael Jones (instructed by the General Counsel and Solicitor to HMRC) for the Respondents
Hearing dates: 14 and 15 June 2017","[('Enyo Law LLP', 'Appellant'), ('the General Counsel and Solicitor to HMRC', 'Respondents')]"
https://www.bailii.org/ew/cases/EWCA/Civ/2017/1485.html,"Mr David Giles (instructed by Patron Law) for the Appellant/Defendant
Mr Nathan Pillow QC (instructed by Steptoe and Johnson UK LLP) for the Respondents/Claimants
Hearing dates : 3 May 2017","[('Patron Law', 'Appellant/Defendant'), ('Steptoe and Johnson UK LLP', 'Respondents/Claimants')]"
https://www.bailii.org/ew/cases/EWCA/Civ/2017/1525.html,"Rhodri Davies QC (instructed by Clyde & Co LLP) for the Appellants
David Joseph QC and Adam Board (instructed by Mildwaters Consulting LLP and Veale Wasborough Vizards) for the Respondent
Hearing date:  27 September 2017","[('Clyde & Co LLP', 'Appellants'), ('Mildwaters Consulting LLP and Veale Wasborough Vizards', 'Respondent')]"
https://www.bailii.org/ew/cases/EWCA/Civ/2017/1756.html,"Miss Rebecca Murray (instructed through the Bar Pro Bono Unit) for the Appellant
Miss Julia Smyth (instructed by the General Counsel and Solicitor to HM Revenue and Customs) for the Respondents
Hearing date : 24 October 2017","[('the General Counsel and Solicitor to HM Revenue and Customs', 'Respondents')]"
https://www.bailii.org/ew/cases/EWCA/Civ/2017/1899.html,"James K Pickup QC and Simon Gurney (instructed by Banks Kelly Solicitors) for the Appellant
Jeremy Benson QC, Christopher Kerr and Ben Hayhurst (instructed by The General Counsel and Solicitor to HM Revenue and Customs) for the Respondents
Hearing dates: 12 July 2017","[('Banks Kelly Solicitors', 'Appellant'), ('The General Counsel and Solicitor to HM Revenue and Customs', 'Respondents')]"
https://www.bailii.org/ew/cases/EWCA/Civ/2017/1845.html,"Mr Kieron Beal QC (instructed by the General Counsel and Solicitor to HMRC) for the Appellants
Mr Hugh Mercer QC and Mr Philippe Dewast (French Advocate) (instructed by Ann L Humphrey Solicitors) for the Respondent
Hearing dates: 4 and 5 October 2017","[('the General Counsel and Solicitor to HMRC', 'Appellants'), ('Ann L Humphrey Solicitors', 'Respondent')]"
https://www.bailii.org/ew/cases/EWCA/Civ/2017/1916.html,"Vikram Sachdeva QC, Stephen McNamara and Catherine Dobson (instructed by Slater and Gordon) for the Appellant
David Blundell (instructed by the Government Legal Department) for the Third Respondent
The First and Second Respondents did not appear and were not represented
Hearing date : 7 November 2017","[('Slater and Gordon', 'Appellant'), ('the Government Legal Department', 'Third Respondent')]"
https://www.bailii.org/ew/cases/EWCA/Civ/2017/2140.html,"The Appellant appeared in person 
Mr Nicholas Vineall QC (instructed by the Legal Group of the Enforcement and Market Oversight Division of the FCA) for the Respondent
Hearing dates: 5 and 6 July 2017","[('the Legal Group of the Enforcement and Market Oversight Division of the FCA', 'Respondent')]"
https://www.bailii.org/ew/cases/EWCA/Civ/2017/1992.html,"Ian Skelt (instructed by GMP Legal Services) for the Appellant
Simon Anderson (instructed by Slater and Gordon LLP) for the Respondent
Hearing date : 22 November 2017","[('GMP Legal Services', 'Appellant'), ('Slater and Gordon LLP', 'Respondent')]"
https://www.bailii.org/ew/cases/EWCA/Civ/2017/1982.html,"Mr Andrew Hitchmough QC and Miss Barbara Belgrano (instructed by PricewaterhouseCoopers LLP) for the Appellant
Miss Eleni Mitrophanous (instructed by the General Counsel and Solicitor to HM Revenue and Customs) for the Respondents
Hearing dates : 8-9 November 2017","[('PricewaterhouseCoopers LLP', 'Appellant'), ('the General Counsel and Solicitor to HM Revenue and Customs', 'Respondents')]"
https://www.bailii.org/ew/cases/EWCA/Civ/2017/2177.html,"James Turner QC and Ms Katy Chokowry (instructed by Miles and Partners Solicitors) for the Appellant
Timothy Scott QC and Miss Clare Renton (instructed by Thomas Dunton Solicitors) for the Respondent
Hearing dates: Tuesday 21 November","[('Miles and Partners Solicitors', 'Appellant'), ('Thomas Dunton Solicitors', 'Respondent')]"
https://www.bailii.org/ew/cases/EWCA/Civ/2017/2124.html,"Mr Malcolm Gammie CBE QC and Ms Catherine Addy QC (instructed by the General Counsel and Solicitor to HM Revenue and Customs) for the Appellants
Mr John Gardiner QC and Mr Daniel Bayfield QC (instructed by Linklaters LLP) for the Respondents
Hearing dates : 31 October and 1 November 2017","[('the General Counsel and Solicitor to HM Revenue and Customs', 'Appellants'), ('Linklaters LLP', 'Respondents')]"
https://www.bailii.org/ew/cases/EWCA/Civ/2017/2105.html,"Jessica Simor QC, David Southern QC and Rebecca Murray (instructed by Pinsent Masons LLP) for the Appellants in both appeals
James Eadie QC, Sam Grodzinski QC, Gemma White QC and David Yates (instructed by the General Counsel and Solicitor to HMRC) for the Respondents
Hearing dates : 18-20 July 2017","[('Pinsent Masons LLP', 'Appellants in both appeals'), ('the General Counsel and Solicitor to HMRC', 'Respondents')]"
https://www.bailii.org/ew/cases/EWCA/Civ/2017/2141.html,"Adrian Davies (instructed by Messrs Lancasters) for the Appellants
Paul Letman (instructed by Rice-Jones and Smiths) for the Respondent
Hearing date : 5 December 2017","[('Messrs Lancasters', 'Appellants'), ('Rice-Jones and Smiths', 'Respondent')]"
https://www.bailii.org/ew/cases/EWCA/Civ/2016/15.html,"Miss Hui Ling McCarthy (instructed by Kingsley Napley Solicitors) for the Appellants
MissJulie Anderson (instructed by Solicitor and General Counsel to the Commissioners for Her Majesty's Revenue and Customs) for the Second Respondents
Hearing dates : 8th December 2015","[('Kingsley Napley Solicitors', 'Appellants'), (""Solicitor and General Counsel to the Commissioners for Her Majesty's Revenue and Customs"", 'Second Respondents')]"
https://www.bailii.org/ew/cases/EWCA/Civ/2016/7.html,"Melanie Hall QC and Elizabeth Kelsey (instructed by Lsbf Legal Department) for the Appellant
Raymond Hill (instructed by HM Revenue and Customs Solicitors Office) for the Respondents
Hearing dates: 7  8 October","[('Lsbf Legal Department', 'Appellant'), ('HM Revenue and Customs Solicitors Office', 'Respondents')]"
https://www.bailii.org/ew/cases/EWCA/Civ/2016/22.html,"Mr Tim Eicke QC and Mr Edward Brown (instructed by the Government Legal Department) for the Appellant
Mr Hugh Southey QC and Mr Paul Turner (instructed by Barnes, Harrild and Dyer) for the Respondent
Hearing date: 17 November 2015","[('the Government Legal Department', 'Appellant'), ('Barnes, Harrild and Dyer', 'Respondent')]"
https://www.bailii.org/ew/cases/EWCA/Civ/2016/29.html,"Karon Monaghan QC, Caoilfhionn Gallagher and Katie O'Byrne (instructed by Hopkin Murray Beskine) for A
Richard Drabble QC and Tom Royston (instructed by Child Poverty Action Group) for the Rutherford appellants (SR, PR and W)
Tim Eicke QC, Gemma White and Edward Brown (instructed by the Treasury Solicitor) for the Secretary of State
Helen Mountfield QC and Raj Desai (instructed by the Equality and Human Rights Commission) for the Intervener
Hearing dates: 4 and 5 November 2015","[('Child Poverty Action Group', 'Rutherford appellants'), ('the Treasury Solicitor', 'Secretary of State'), ('the Equality and Human Rights Commission', 'Intervener')]"
https://www.bailii.org/ew/cases/EWCA/Civ/2016/19.html,"Mr Keith Gordon and Miss Ximena Montes Manzano (instructed by Bramhall Solicitors) for the Appellant
Mr David Yates (instructed by the General Counsel and Solicitor to HM Revenue and Customs) for the Respondents
Hearing date : 15 December 2015","[('Bramhall Solicitors', 'Appellant'), ('the General Counsel and Solicitor to HM Revenue and Customs', 'Respondents')]"
https://www.bailii.org/ew/cases/EWCA/Civ/2016/73.html,"MR MICHAEL POOLES QC & MR JAMIE SMITH QC (instructed by Berrymans Lace Mawer LLP) for the Apellants
MR ROGER STEWART QC & MR SCOTT ALLEN (instructed by Beale and Company Solicitors LLP) for the Respondents
Hearing dates : 26 & 27 January 2016","[('Berrymans Lace Mawer LLP', 'Apellants'), ('Beale and Company Solicitors LLP', 'Respondents')]"
https://www.bailii.org/ew/cases/EWCA/Civ/2016/87.html,"Naomi Ellenbogen QC and Sam Neaman (instructed by BPE Solicitors) for the Appellant
Paul Nicholls QC and Simon Forshaw (instructed by Slaughter and May) for the Respondent
Hearing dates: 19 and 20 January 2016","[('BPE Solicitors', 'Appellant'), ('Slaughter and May', 'Respondent')]"
https://www.bailii.org/ew/cases/EWCA/Civ/2016/157.html,"David Yates (instructed by the General Counsel and Solicitor to HM Revenue and Customs) for the Appellants
Rory Mullan and Oliver Marre (instructed by Bury Walkers LLP) for the Respondents
Hearing dates:  24 and 25 November 2015","[('the General Counsel and Solicitor to HM Revenue and Customs', 'Appellants'), ('Bury Walkers LLP', 'Respondents')]"
https://www.bailii.org/ew/cases/EWCA/Civ/2016/153.html,"Mr Louis Weston (instructed by Bower and Bailey LLP) for the Appellant/Defendant
Mr Malcolm Birdling (instructed by Moon Beever) for the Respondent/Claimant 
Hearing date: Tuesday 9th February 2016","[('Bower and Bailey LLP', 'Appellant/Defendant'), ('Moon Beever', 'Respondent/Claimant')]"
https://www.bailii.org/ew/cases/EWCA/Civ/2016/154.html,"Richard Clayton QC and Lee Parkhill (instructed by Sharpe Pritchard LLP) for the Appellant
Iain Steele (instructed by Litigation and Review Team) for the Respondent
Hearing date: 10/02/2016","[('Sharpe Pritchard LLP', 'Appellant'), ('Litigation and Review Team', 'Respondent')]"
https://www.bailii.org/ew/cases/EWCA/Civ/2016/376.html,"David Ewart QC, Rupert Baldry QC, Andrew Burrows QC (Hon) and Barbara Belgrano (instructed by HM Revenue and Customs Solicitor's Office) for the Appellants
Graham Aaronson QC, Tom Beazley QC and Jonathan Bremner (instructed by Joseph Hage Aaronson LLP) for the Respondent
Hearing dates: 11/03/2016 to 18/03/2016","[(""HM Revenue and Customs Solicitor's Office"", 'Appellants'), ('Joseph Hage Aaronson LLP', 'Respondent')]"
https://www.bailii.org/ew/cases/EWCA/Civ/2016/437.html,"Stephen Cottle (instructed by Lester Morrill Inc Davies Core Lomax) for the Appellants
David Lintott (instructed by Wokingham Borough Council and Royal Borough of Windsor) for the Respondent
Hearing date: 26 April 2016","[('Lester Morrill Inc Davies Core Lomax', 'Appellants'), ('Wokingham Borough Council and Royal Borough of Windsor', 'Respondent')]"
https://www.bailii.org/ew/cases/EWCA/Civ/2016/474.html,"Stephen Davies QC and Oliver Mitchell (instructed by Kennedys) for the Appellants 
Hilary Stonefrost (instructed by Slaughter and May) for the Respondents
Hearing dates: Thursday 25 February 2016","[('Kennedys', 'Appellants'), ('Slaughter and May', 'Respondents')]"
https://www.bailii.org/ew/cases/EWCA/Civ/2016/436.html,"Jonathan Peacock QC (instructed by Forbes Hall LLP) for the Appellants
Andrew Macnab (instructed by General Counsel and Solicitor to HMRC) for the Respondents
Hearing date: Friday 8th April 2016","[('Forbes Hall LLP', 'Appellants'), ('General Counsel and Solicitor to HMRC', 'Respondents')]"
https://www.bailii.org/ew/cases/EWCA/Civ/2016/485.html,"Roger Thomas QC (instructed by Clifford Chance LLP) for the Appellant
Malcolm Gammie CBE QC and Hui Ling McCarthy (instructed by the General Counsel and Solicitor to HM Revenue and Customs) for the Respondents
Hearing dates : 10, 11 and 12 May 2016","[('Clifford Chance LLP', 'Appellant'), ('the General Counsel and Solicitor to HM Revenue and Customs', 'Respondents')]"
https://www.bailii.org/ew/cases/EWCA/Civ/2016/447.html,"Michael Sherry (instructed by Shipleys LLP) for the Appellant
Aparna Nathan (instructed by the General Counsel and Solicitor to HM Revenue and Customs) for the Respondent
Hearing date: 28 April 2016","[('Shipleys LLP', 'Appellant'), ('the General Counsel and Solicitor to HM Revenue and Customs', 'Respondent')]"
https://www.bailii.org/ew/cases/EWCA/Civ/2016/800.html,"Mary O'Rourke QC and Nicola Newbegin (instructed by Gunnercooke LLP) for the Appellant
Mohinderpal Sethi (instructed by Slater and Gordon Lawyers) for the Respondents
Hearing date: 6 July 2016","[('Gunnercooke LLP', 'Appellant'), ('Slater and Gordon Lawyers', 'Respondents')]"
https://www.bailii.org/ew/cases/EWCA/Civ/2016/760.html,"Paul Stanley QC and David Peters (instructed by Byrne and Partners LLP) for the Appellants
Jonathan Hall QC and Alexander Cook (instructed by National Crime Agency) for the Respondent
Hearing dates : 21 June, 2016","[('Byrne and Partners LLP', 'Appellants'), ('National Crime Agency', 'Respondent')]"
https://www.bailii.org/ew/cases/EWCA/Civ/2016/761.html,"Rebecca Murray (instructed by Bar Pro Bono Unit) for the Appellant
Richard Vallat (instructed by General Counsel and Solicitor to HM Revenue and Customs) for the Respondents
Hearing date: 27/06/2016","[('Bar Pro Bono Unit', 'Appellant'), ('General Counsel and Solicitor to HM Revenue and Customs', 'Respondents')]"
https://www.bailii.org/ew/cases/EWCA/Civ/2016/663.html,"Hui Ling McCarthy (instructed by Forbes Hall LLP) for the Appellant
Nicola Shaw QC and Aparna Nathan (instructed by General Counsel and Solicitor to HM Revenue and Customs) for the Respondents
Hearing dates : 14 and 15 June 2016","[('Forbes Hall LLP', 'Appellant'), ('General Counsel and Solicitor to HM Revenue and Customs', 'Respondents')]"
https://www.bailii.org/ew/cases/EWCA/Civ/2016/719.html,"Lord Pannick QC and Hanif Mussa (instructed by Slaughter and May) for the 1st Appellants
Monica Carss-Frisk QC and Jessica Boyd (instructed by Burges Salmon) for the 2nd Appellants
Daniel Beard QC, Andrew Henshaw QC and Brendan McGurk (instructed by CMA Litigation Unit) for the Respondent
Hearing dates: 22 & 23/06/2016","[('Slaughter and May', '1st Appellants'), ('Burges Salmon', '2nd Appellants'), ('CMA Litigation Unit', 'Respondent')]"
